{
  "files": {
    "README.md": "e9cb7533c9e503cc9ffe71cc421ffe505306d21a0dc1c9276733413f0cbaf5b5",
    "bin/jbpa": "bdc2ff0e8c8db149e312cb99ff6452340b3a2402b401a82ee50fadcc4ab89864",
    "config/agent.example.yaml": "faaad63649aa8fa91fc7e0c721c631417a680ec3b00f8633caedb8fe63a574b4",
    "config/examples/azure-production.example.yaml": "faaad63649aa8fa91fc7e0c721c631417a680ec3b00f8633caedb8fe63a574b4",
    "config/examples/azure-qa.example.yaml": "8adca4a0125d8cb335c7f70de639f8f48fd6d03b6fd2437541828260c7381d86",
    "config/os-support.yaml": "ec83d1de65e210e380420f555fffdfe6fb7624bebfe484f5d44a34c09c12ab1f",
    "config/schemas/agent.schema.json": "aea1022adf94fbad72e1f076c87734c17d918f56b54a4be737573d5d14be9a6a",
    "config/schemas/artifact-manifest.schema.json": "816b0489422f90a337a47aa65ecc843d79dd03f6fd85c14e96bec731b2fff358",
    "config/schemas/bootstrap-result.schema.json": "e7f9cce18382689559752e3f9323ec65d51aa825d9fe25622db796362bb6c6df",
    "config/schemas/os-support.schema.json": "afed521e1c766b9879234963ff728d52df41fb002f5cea4f171dda9299db4976",
    "config/schemas/rc-result.schema.json": "88bed0ece5357f7bf555431eb7569ca9eca9ffd10c6a211e54956a55c372a47c",
    "config/schemas/release-manifest.schema.json": "932ece7c5a6f2c45a7567056f3bfd4fe612bfab320fbb642714d645e9486bd41",
    "config/schemas/result.schema.json": "c39e43cc43c988d918b1b6032e1bb4b2670f2cb17c2f5a0e575bb10f5410c43a",
    "config/schemas/runtime-contract.schema.json": "d12049c261916bc9502e13e28ef4e0152e31d32e7748cd1283c1d31996a55b56",
    "config/schemas/versions.schema.json": "286246b019da01f925ed367efe4cc85309e20fe044b4a63ae5a25e72cf8e893c",
    "config/versions.yaml": "8c9c822189fe3f323906fc25f65d790deca83501d91ec5f422fadb68db0cc9de",
    "contracts/12.10.1.1.yaml": "369d6e98d30b4c73509be1de3472ca640e3a2c58ebf8715db7b46d448dc90e1d",
    "contracts/12.9.2.2.yaml": "ac8fc2b65c316f384dc486edb2fddbc32d9859a5b60bd18b5089f0fe53f858e2",
    "docs/README.md": "ee8500dc3cd1678500fe6a881adbb4f8e6a69da99a5862759b3e951b23c81afe",
    "docs/architecture.md": "2ead36d359208cf7a1706df19338a71c6b89373cf60199d5d74753e9fef81b00",
    "docs/azure-ai-agent-contract.md": "4c2ebba04b8d8028b513362524fc2a90a14259ddd6faad696ae15f51839b818d",
    "docs/configuration.md": "efe9b744af568ada4bce95320b39363bd43dd6570a0520db209cd742904babe0",
    "docs/errors.md": "4406b63ead7c4cd8c51c79949a8490a2e6d801eb48c93602baa2f8cc31c2ceda",
    "docs/health-contract.md": "28d6c9eb0b6d0c07b8203be042b654e2624263c1b837a2b0bb30a2241ea5057f",
    "docs/lifecycle-management.md": "e855ae2688eff596b1a22d78d3e9cbdaac394d8323a3178434fe68c2494c780c",
    "docs/production-readiness.md": "2b8353cc54e52530dc7dfbbeeea33b86363c1960d319e77b50ab7ed1cc17ca09",
    "docs/runbooks/diagnostics.md": "6f0589969dab371e060035d7e77234228c32df412cf9c58ef6b091f4451c3c52",
    "docs/runbooks/enterprise-truststore.md": "a988e5b3678d2502d21868217b19866fb59255599c6ccf83f0badd7affe1d8a5",
    "docs/runbooks/handle-latest-pa-change.md": "77aff6f546056a23790652d47bfab618eaf6188cf63bd4813a01a29b4e7ef317",
    "docs/runbooks/health.md": "f47860d47252ea904edf656dabd3a5ab656740676eee400888e99068d1f113bf",
    "docs/runbooks/install.md": "a54c7df74152ae2035b74f8f44e0d639aac62ea5a323ab1c83464d32772df4d5",
    "docs/runbooks/native-linux-jks-custom-ca.md": "893e59eb3336a23b62a3638269126adcf264600fd6dac6de9d6a862256b19511",
    "docs/runbooks/native-linux-pa-install-tested.md": "6a18e2b30baa4993623a9efde1861eb1f98a33ec3657f81f03c6e0637b399fa2",
    "docs/runbooks/native-linux-pa-uninstall.md": "5967056d725d64aa9e9e504cf09d16cdd32568f9ab22659849c0cac8ab2e8862",
    "docs/runbooks/onboard-new-pa-version.md": "eaa03127869bbef0b76c598a8d253ac05a4fe23ca259925dca8e362fc8d58c23",
    "docs/runbooks/uninstall.md": "7ac6a88f0c5d78ea493ab51749c8c190d1ac3b8d09ed0479113a435f7c372c0d",
    "docs/security-review.md": "ce1a270a54938b99b5d954a62c6d940eea7264399961f95054a9b957ba1480c8",
    "docs/version-qualification-matrix.md": "e7d5ae77f7bef377c9b67023e66456f4dc947e21f0d1fcce4ea815d8908daeda",
    "lib/jbpa/__init__.py": "630c42ca4ed2ecd29bd9c3354e4b063ed2e73a11022a72d2af0d37a069da9619",
    "lib/jbpa/artifacts.py": "1f27a36f3deeee6fd033b4f942d36a1c682c90099eda84aa3478c341d64414ca",
    "lib/jbpa/azure_artifact.py": "cc75e25fd3a5d363f1341cc3182dc43787a616414509380b248cb097523fa94f",
    "lib/jbpa/azure_identity.py": "8b30be14b1163cb1019ed39be0b1f7e4c062fa8ca12a44b8177b2f5f2501a4b5",
    "lib/jbpa/bootstrap.py": "bf601f088a22c2566a87b09dcaae12c8f4ea286e2968d94f49979e4e604ebe00",
    "lib/jbpa/catalogue.py": "65db1f7f65f178164ce710ffac6537baa063e9e42ec6d9461949378da81638c5",
    "lib/jbpa/cli.py": "2ca83035dd5f3a05efff17f613c9f54e63b6453872c97ebe6b742bbe98556813",
    "lib/jbpa/config.py": "dcb23f6f170d5e5616065054bd2f81d1b3120b7b6681091eb6d7a129e996eaa0",
    "lib/jbpa/enterprise.py": "78e75de12162eae55a192dbdad3ebb6f7842df9fadef9fbd32a0519456a91898",
    "lib/jbpa/errors.py": "a5233bc68a777b935d6747edbb1ff90b1c826aaf76cc983b4f99513c25e770d1",
    "lib/jbpa/health.py": "5666569c5e1564a48446b5287998bda9f19e6348dcf54e7c951fa5ca292cb198",
    "lib/jbpa/host_lock.py": "5ee946dc7d20a6427b1774b98804465d93d266b1381e34c0b3d4410b50fa779d",
    "lib/jbpa/native_linux.py": "92d1ae117c1353f1843bad9e105cbf8dbc32b5173eeb3a4aee004922d4496965",
    "lib/jbpa/pending_operations.py": "8f867ab534dca038aaea49d1986c63699adb9f510864e6d345563a6444c533fb",
    "lib/jbpa/platform.py": "16db56468a1dce6e1c9928f401e389b0cd212c90826663786c40673f7bda6721",
    "lib/jbpa/preflight.py": "21de5d4ceb0a346074f9a47258f56773c2c1a6447fc6f228601dfa078126964b",
    "lib/jbpa/providers.py": "fd1e4f98e866b569afa4fabc4f40787b3c6eb1bbee3682f36a96d1d952371891",
    "lib/jbpa/qualification.py": "3bf9a0c967a7a755d34fc2d4146040b58e04c3113bf05fd69712b6ef19b0b678",
    "lib/jbpa/regression.py": "284d8524f3b4389e55cb7d249f4831a704a6e2f381e4f6d3a1a279ff2a67d917",
    "lib/jbpa/release.py": "12f3fc85ce17054e83e26c328c3995a0f78fd441c6f35c59a16bc35c8b762d16",
    "lib/jbpa/release_cli.py": "37954b4f271b64daf40567a2ffe586ca0edea91751d363c9fae9b0513c9b8059",
    "lib/jbpa/restart_health.py": "ad1f46b86d8c9e0bd63e336ee4c20e5c1b36e26803dbaf9e8e3180126a2e115c",
    "lib/jbpa/results.py": "f14baf3010f6cd11149602a31bb0131e39055b01858c16c0c4930f31bfff6f6c",
    "lib/jbpa/security.py": "ff917c444a4a7ecabf99e0deca2eda61699dea35f20700e541348bc9291762ef",
    "lib/jbpa/uninstall.py": "6ca700d480e7eabb0e195305447e1a525547781658df1be6faca9eb6c54a6618",
    "requirements.txt": "cd2287ae0afa53b81012666054b035e57d007dfb92ddbff1383bee7ee2b6858b",
    "schemas/agent.schema.json": "aea1022adf94fbad72e1f076c87734c17d918f56b54a4be737573d5d14be9a6a",
    "schemas/artifact-manifest.schema.json": "816b0489422f90a337a47aa65ecc843d79dd03f6fd85c14e96bec731b2fff358",
    "schemas/bootstrap-result.schema.json": "e7f9cce18382689559752e3f9323ec65d51aa825d9fe25622db796362bb6c6df",
    "schemas/os-support.schema.json": "afed521e1c766b9879234963ff728d52df41fb002f5cea4f171dda9299db4976",
    "schemas/rc-result.schema.json": "88bed0ece5357f7bf555431eb7569ca9eca9ffd10c6a211e54956a55c372a47c",
    "schemas/release-manifest.schema.json": "932ece7c5a6f2c45a7567056f3bfd4fe612bfab320fbb642714d645e9486bd41",
    "schemas/result.schema.json": "c39e43cc43c988d918b1b6032e1bb4b2670f2cb17c2f5a0e575bb10f5410c43a",
    "schemas/runtime-contract.schema.json": "d12049c261916bc9502e13e28ef4e0152e31d32e7748cd1283c1d31996a55b56",
    "schemas/versions.schema.json": "286246b019da01f925ed367efe4cc85309e20fe044b4a63ae5a25e72cf8e893c"
  },
  "jbpaVersion": "1.0.0-rc1",
  "latestAvailablePinnedPA": "12.10",
  "latestTestedPA": "12.10",
  "productionApproved": false,
  "pythonRequirement": ">=3.10",
  "recommendedPA": "12.10",
  "releaseStatus": "RELEASE_CANDIDATE_QA",
  "runtimeScopes": {
    "12.10": {
      "overall": "TESTED_LIVE",
      "platforms": {
        "ubuntu-22.04-amd64": "NOT_TESTED",
        "ubuntu-24.04-amd64": "TESTED_LIVE"
      },
      "scope": [
        "installation",
        "registration",
        "health",
        "drain",
        "uninstall",
        "reinstall",
        "endpoint-trust"
      ]
    },
    "12.9": {
      "overall": "TESTED_LIVE",
      "platforms": {
        "ubuntu-22.04-amd64": "NOT_TESTED",
        "ubuntu-24.04-amd64": "TESTED_LIVE"
      },
      "scope": [
        "installation",
        "registration",
        "health"
      ]
    }
  },
  "schemaVersion": "1.0",
  "schemaVersions": {
    "artifactManifest": "1.0",
    "catalogue": "2.0",
    "config": "1.0",
    "result": "1.0",
    "runtimeContract": "1.0"
  },
  "testedPackages": [
    "12.10.1.1",
    "12.9.2.2"
  ],
  "testedPlatforms": [
    {
      "architecture": "amd64",
      "os": "ubuntu",
      "version": "24.04.5"
    },
    {
      "architecture": "amd64",
      "os": "ubuntu",
      "version": "24.04"
    }
  ]
}
